{
  "id": "c3d4e5f6-a7b8-4789-c012-3456789abcde",
  "title": "Write the Stripe connector module",
  "description": "Implement the connector with retries and idempotency keys.",
  "parent_type": "project",
  "parent_id": "b2c3d4e5-f6a7-4789-b012-3456789abcde",
  "assignee_id": "c1d2e3f4-a5b6-4789-c012-3456789abcde",
  "state": "in_progress",
  "done_reason": null,
  "due_date": "2026-05-10",
  "estimate_hours": 16,
  "done_at": null,
  "created_at": "2026-04-01T09:00:00Z",
  "updated_at": "2026-04-19T10:00:00Z"
}
